{"note":"Parity vectors for the browser implementation of analytics/newsvendor.py. Compare every expected field with relative tolerance 1e-6 (absolute 1e-9 near zero). The browser needs an inverse normal CDF accurate to about 1e-9 (for example Acklam's rational approximation plus one Halley refinement step using erfc). Empirical Q* is the smallest sample with F(d) >= cf, ties by sorted order.","schema_version":"v1","tags":{"vectors":"SIMULATED"},"tolerance_rel":1e-06,"vectors":[{"case":"normal_family:Bags and purses_0.6_0.2","expected":{"critical_fractile":0.4545454545454546,"expected_leftover":1346.5567861725758,"expected_profit":10313.193246956389,"expected_sales":16831.556026199047,"expected_shortage":1792.9439738009532,"q_star":18178.112812371623,"service_level":0.45454545454545464},"inputs":{"cost":1.0167,"mu":18624.5,"price":1.6945,"salvage":0.20334,"samples":null,"sigma":3909.3229148388527},"model":"normal"},{"case":"normal_family:Bags and purses_0.4_0.0","expected":{"critical_fractile":0.6,"expected_leftover":2104.587100594268,"expected_profit":16376.261884855972,"expected_sales":17510.328535102555,"expected_shortage":1114.1714648974448,"q_star":19614.915635696823,"service_level":0.5999999999999999},"inputs":{"cost":0.6778,"mu":18624.5,"price":1.6945,"salvage":0.0,"samples":null,"sigma":3909.3229148388527},"model":"normal"},{"case":"normal_family:Bags and purses_0.8_0.5","expected":{"critical_fractile":0.3333333333333333,"expected_leftover":860.1448972410017,"expected_profit":4866.676255884361,"expected_sales":16080.503001576615,"expected_shortage":2543.996998423385,"q_star":16940.647898817617,"service_level":0.3333333333333335},"inputs":{"cost":1.3556,"mu":18624.5,"price":1.6945,"salvage":0.6778,"samples":null,"sigma":3909.3229148388527},"model":"normal"},{"case":"normal_family:Bath and personal care_0.6_0.2","expected":{"critical_fractile":0.4545454545454545,"expected_leftover":141.61230520638924,"expected_profit":924.774449309389,"expected_sales":1259.4428356508117,"expected_shortage":188.55716434918827,"q_star":1401.055140857201,"service_level":0.4545454545454545},"inputs":{"cost":1.2732,"mu":1448.0,"price":2.122,"salvage":0.25464,"samples":null,"sigma":411.12876593942593},"model":"normal"},{"case":"normal_family:Bath and personal care_0.4_0.0","expected":{"critical_fractile":0.6,"expected_leftover":221.33149814640547,"expected_profit":1506.5424854058185,"expected_sales":1330.8267837201442,"expected_shortage":117.17321627985575,"q_star":1552.1582818665497,"service_level":0.5999999999999999},"inputs":{"cost":0.8488,"mu":1448.0,"price":2.122,"salvage":0.0,"samples":null,"sigma":411.12876593942593},"model":"normal"},{"case":"normal_family:Bath and personal care_0.8_0.5","expected":{"critical_fractile":0.33333333333333326,"expected_leftover":90.45819898619561,"expected_profit":424.2052088988858,"expected_sales":1180.4574179980411,"expected_shortage":267.54258200195886,"q_star":1270.9156169842367,"service_level":0.33333333333333326},"inputs":{"cost":1.6976,"mu":1448.0,"price":2.122,"salvage":0.8488,"samples":null,"sigma":411.12876593942593},"model":"normal"},{"case":"normal_family:Candles and fragrance_0.6_0.2","expected":{"critical_fractile":0.4545454545454546,"expected_leftover":516.7464566136387,"expected_profit":5225.787064387229,"expected_sales":9710.950706511327,"expected_shortage":688.0492934886734,"q_star":10227.697163124965,"service_level":0.45454545454545464},"inputs":{"cost":0.86226,"mu":10399.0,"price":1.4371,"salvage":0.172452,"samples":null,"sigma":1500.2180262619675},"model":"normal"},{"case":"normal_family:Candles and fragrance_0.4_0.0","expected":{"critical_fractile":0.6,"expected_leftover":807.6435676790552,"expected_profit":8133.701406684144,"expected_sales":9971.432323346522,"expected_shortage":427.567676653478,"q_star":10779.075891025577,"service_level":0.6000000000000001},"inputs":{"cost":0.57484,"mu":10399.0,"price":1.4371,"salvage":0.0,"samples":null,"sigma":1500.2180262619675},"model":"normal"},{"case":"normal_family:Candles and fragrance_0.8_0.5","expected":{"critical_fractile":0.3333333333333333,"expected_leftover":330.08398337730796,"expected_profit":2518.5359123750113,"expected_sales":9422.731157816514,"expected_shortage":976.2688421834864,"q_star":9752.815141193822,"service_level":0.3333333333333335},"inputs":{"cost":1.14968,"mu":10399.0,"price":1.4371,"salvage":0.57484,"samples":null,"sigma":1500.2180262619675},"model":"normal"},{"case":"normal_family:Garden and outdoor_0.6_0.2","expected":{"critical_fractile":0.45454545454545453,"expected_leftover":236.94466256954865,"expected_profit":1110.512758111193,"expected_sales":1352.2575460308685,"expected_shortage":315.4924539691315,"q_star":1589.2022086004172,"service_level":0.4545454545454545},"inputs":{"cost":1.55982,"mu":1667.75,"price":2.5997,"salvage":0.311964,"samples":null,"sigma":687.8976129664553},"model":"normal"},{"case":"normal_family:Garden and outdoor_0.4_0.0","expected":{"critical_fractile":0.6,"expected_leftover":370.3302270793529,"expected_profit":1910.482857124226,"expected_sales":1471.69664041973,"expected_shortage":196.0533595802699,"q_star":1842.026867499083,"service_level":0.6},"inputs":{"cost":1.03988,"mu":1667.75,"price":2.5997,"salvage":0.0,"samples":null,"sigma":687.8976129664553},"model":"normal"},{"case":"normal_family:Garden and outdoor_0.8_0.5","expected":{"critical_fractile":0.33333333333333337,"expected_leftover":151.35399006601438,"expected_profit":476.9886658591781,"expected_sales":1220.0997289091524,"expected_shortage":447.6502710908476,"q_star":1371.4537189751668,"service_level":0.33333333333333326},"inputs":{"cost":2.07976,"mu":1667.75,"price":2.5997,"salvage":1.03988,"samples":null,"sigma":687.8976129664553},"model":"normal"},{"case":"normal_family:Home decor_0.6_0.2","expected":{"critical_fractile":0.4545454545454545,"expected_leftover":1230.248677839587,"expected_profit":17810.502811227227,"expected_sales":22220.920584516378,"expected_shortage":1638.0794154836221,"q_star":23451.169262355965,"service_level":0.45454545454545464},"inputs":{"cost":1.28784,"mu":23859.0,"price":2.1464,"salvage":0.257568,"samples":null,"sigma":3571.657279229007},"model":"normal"},{"case":"normal_family:Home decor_0.4_0.0","expected":{"critical_fractile":0.6,"expected_leftover":1922.8045370917753,"expected_profit":27764.793426853685,"expected_sales":22841.064487994787,"expected_shortage":1017.9355120052132,"q_star":24763.869025086562,"service_level":0.6000000000000001},"inputs":{"cost":0.85856,"mu":23859.0,"price":2.1464,"salvage":0.0,"samples":null,"sigma":3571.657279229007},"model":"normal"},{"case":"normal_family:Home decor_0.8_0.5","expected":{"critical_fractile":0.33333333333333326,"expected_leftover":785.8503506480338,"expected_profit":8569.733233459796,"expected_sales":21534.739355460693,"expected_shortage":2324.2606445393067,"q_star":22320.589706108727,"service_level":0.33333333333333326},"inputs":{"cost":1.71712,"mu":23859.0,"price":2.1464,"salvage":0.85856,"samples":null,"sigma":3571.657279229007},"model":"normal"},{"case":"normal_family:Jewellery and accessories_0.6_0.2","expected":{"critical_fractile":0.45454545454545453,"expected_leftover":289.10477622710096,"expected_profit":1125.0579955829403,"expected_sales":2593.8062147424935,"expected_shortage":384.94378525750653,"q_star":2882.9109909695944,"service_level":0.4545454545454545},"inputs":{"cost":0.75108,"mu":2978.75,"price":1.2518,"salvage":0.150216,"samples":null,"sigma":839.3288260099538},"model":"normal"},{"case":"normal_family:Jewellery and accessories_0.4_0.0","expected":{"critical_fractile":0.6,"expected_leftover":451.8533410664272,"expected_profit":1831.3603354878214,"expected_sales":2739.5381855815663,"expected_shortage":239.21181441843373,"q_star":3191.3915266479935,"service_level":0.6},"inputs":{"cost":0.50072,"mu":2978.75,"price":1.2518,"salvage":0.0,"samples":null,"sigma":839.3288260099538},"model":"normal"},{"case":"normal_family:Jewellery and accessories_0.8_0.5","expected":{"critical_fractile":0.33333333333333326,"expected_leftover":184.67249253301998,"expected_profit":516.545426834434,"expected_sales":2432.5556690188855,"expected_shortage":546.1943309811145,"q_star":2617.2281615519055,"service_level":0.33333333333333326},"inputs":{"cost":1.00144,"mu":2978.75,"price":1.2518,"salvage":0.50072,"samples":null,"sigma":839.3288260099538},"model":"normal"},{"case":"normal_sku:84077_0.6_0.2","expected":{"critical_fractile":0.45454545454545453,"expected_leftover":364.6197576529495,"expected_profit":7.216836200010961,"expected_sales":499.75781435604756,"expected_shortage":485.49218564395244,"q_star":864.377572008997,"service_level":0.45454545454545453},"inputs":{"cost":0.174,"mu":985.25,"price":0.29,"salvage":0.0348,"samples":null,"sigma":1058.5638782061594},"model":"normal"},{"case":"normal_sku:84077_0.4_0.0","expected":{"critical_fractile":0.6,"expected_leftover":569.8787057910665,"expected_profit":52.83270733341536,"expected_sales":683.5553862366614,"expected_shortage":301.69461376333857,"q_star":1253.434092027728,"service_level":0.6},"inputs":{"cost":0.116,"mu":985.25,"price":0.29,"salvage":0.0,"samples":null,"sigma":1058.5638782061594},"model":"normal"},{"case":"normal_sku:84077_0.8_0.5","expected":{"critical_fractile":0.33333333333333315,"expected_leftover":232.9094674647016,"expected_profit":-9.826984241563078,"expected_sales":296.38817214383323,"expected_shortage":688.8618278561668,"q_star":529.2976396085348,"service_level":0.33333333333333315},"inputs":{"cost":0.232,"mu":985.25,"price":0.29,"salvage":0.116,"samples":null,"sigma":1058.5638782061594},"model":"normal"},{"case":"normal_sku:85099B_0.6_0.2","expected":{"critical_fractile":0.4545454545454546,"expected_leftover":187.3372043993479,"expected_profit":722.8691842393814,"expected_sales":1151.5600096886808,"expected_shortage":249.4399903113192,"q_star":1338.8972140880287,"service_level":0.45454545454545453},"inputs":{"cost":1.17,"mu":1401.0,"price":1.95,"salvage":0.234,"samples":n